{
  "$schema": "http://json-schema.org/draft-07/schema#",
  "title": "GongfaSchema",
  "description": "M3 功法数据结构定义",
  "type": "object",
  "required": [
    "id",
    "name",
    "type",
    "element",
    "quality",
    "passive_effects",
    "skills",
    "tags"
  ],
  "properties": {
    "id": {
      "type": "string",
      "pattern": "^[a-z0-9_]+$"
    },
    "name": {
      "type": "string",
      "minLength": 1
    },
    "type": {
      "type": "string",
      "enum": [
        "neigong",
        "waigong",
        "qinggong",
        "zhenfa"
      ]
    },
    "description": {
      "type": "string"
    },
    "element": {
      "type": "string",
      "enum": [
        "metal",
        "wood",
        "water",
        "fire",
        "earth",
        "none"
      ]
    },
    "quality": {
      "type": "string",
      "enum": [
        "white",
        "green",
        "blue",
        "purple",
        "orange"
      ]
    },
    "cost": {
      "type": "integer",
      "minimum": 1
    },
    "shop_visible": {
      "type": "boolean",
      "default": true
    },
    "tags": {
      "type": "array",
      "items": {
        "type": "string"
      }
    },
    "passive_effects": {
      "type": "array",
      "items": {
        "type": "object",
        "required": [
          "op"
        ]
      }
    },
    "skills": {
      "type": "array",
      "items": {
        "type": "object",
        "required": [
          "trigger",
          "effects"
        ],
        "properties": {
          "trigger": {
            "type": "string"
          },
          "effects": {
            "type": "array"
          },
          "range": {
            "type": "number",
            "minimum": 0
          }
        }
      }
    }
  },
  "additionalProperties": true
}
