[
  {
    "id": "gf_shaolin_core_neigong_00",
    "name": "????????????",
    "type": "neigong",
    "description": "????????????????",
    "element": "earth",
    "quality": "blue",
    "cost": 260,
    "shop_visible": true,
    "tags": [
      "sect.tag_sect_shaolin",
      "sect_name.??",
      "style.shaolin_guard",
      "style.shaolin_strike",
      "type.neigong",
      "role.shared_core"
    ],
    "passive_effects": [
      {
        "op": "stat_add",
        "stat": "iat",
        "value": 14
      },
      {
        "op": "mp_regen_add",
        "value": 1.2
      },
      {
        "op": "tenacity",
        "value": 0.04
      }
    ],
    "skills": [
      {
        "trigger": "periodic_seconds",
        "trigger_params": {
          "interval": 5.2
        },
        "mp_cost": 12,
        "effects": [
          {
            "op": "buff_self",
            "buff_id": "buff_sect_guard_drill",
            "duration": 2.4
          },
          {
            "op": "mp_regen_add",
            "value": 1.6
          }
        ]
      }
    ]
  },
  {
    "id": "gf_shaolin_guard_neigong_04",
    "name": "???????????",
    "type": "neigong",
    "description": "????????????",
    "element": "earth",
    "quality": "purple",
    "cost": 360,
    "shop_visible": true,
    "tags": [
      "sect.tag_sect_shaolin",
      "sect_name.??",
      "style.shaolin_guard",
      "type.neigong"
    ],
    "passive_effects": [
      {
        "op": "stat_add",
        "stat": "iat",
        "value": 14
      },
      {
        "op": "mp_regen_add",
        "value": 0.88
      }
    ],
    "skills": [
      {
        "trigger": "periodic_seconds",
        "trigger_params": {
          "interval": 4.45
        },
        "mp_cost": 16,
        "effects": [
          {
            "op": "buff_self",
            "buff_id": "buff_sect_guard_drill",
            "duration": 2.75
          },
          {
            "op": "heal_self",
            "value": 29.4
          }
        ]
      }
    ]
  },
  {
    "id": "gf_shaolin_guard_neigong_07",
    "name": "???????????",
    "type": "neigong",
    "description": "????????????",
    "element": "earth",
    "quality": "orange",
    "cost": 520,
    "shop_visible": true,
    "tags": [
      "sect.tag_sect_shaolin",
      "sect_name.??",
      "style.shaolin_guard",
      "type.neigong"
    ],
    "passive_effects": [
      {
        "op": "stat_add",
        "stat": "iat",
        "value": 17
      },
      {
        "op": "mp_regen_add",
        "value": 1.07
      }
    ],
    "skills": [
      {
        "trigger": "periodic_seconds",
        "trigger_params": {
          "interval": 4.05
        },
        "mp_cost": 18,
        "effects": [
          {
            "op": "buff_self",
            "buff_id": "buff_sect_guard_drill",
            "duration": 3.0
          },
          {
            "op": "heal_self",
            "value": 39.2
          }
        ]
      }
    ]
  },
  {
    "id": "gf_shaolin_strike_neigong_04",
    "name": "???????????",
    "type": "neigong",
    "description": "????????????",
    "element": "metal",
    "quality": "purple",
    "cost": 360,
    "shop_visible": true,
    "tags": [
      "sect.tag_sect_shaolin",
      "sect_name.??",
      "style.shaolin_strike",
      "type.neigong"
    ],
    "passive_effects": [
      {
        "op": "stat_add",
        "stat": "iat",
        "value": 18
      },
      {
        "op": "mp_regen_add",
        "value": 0.88
      }
    ],
    "skills": [
      {
        "trigger": "periodic_seconds",
        "trigger_params": {
          "interval": 4.45
        },
        "mp_cost": 16,
        "effects": [
          {
            "op": "damage_aoe",
            "value": 44.8,
            "radius": 2,
            "damage_type": "internal"
          },
          {
            "op": "debuff_aoe",
            "buff_id": "debuff_sect_exposed_gap",
            "duration": 2.15,
            "radius": 2
          }
        ]
      }
    ]
  },
  {
    "id": "gf_wudang_core_neigong_00",
    "name": "????????????",
    "type": "neigong",
    "description": "????????????????",
    "element": "water",
    "quality": "blue",
    "cost": 260,
    "shop_visible": true,
    "tags": [
      "sect.tag_sect_wudang",
      "sect_name.??",
      "style.wudang_taiji",
      "style.wudang_sword",
      "type.neigong",
      "role.shared_core"
    ],
    "passive_effects": [
      {
        "op": "stat_add",
        "stat": "iat",
        "value": 14
      },
      {
        "op": "mp_regen_add",
        "value": 1.2
      },
      {
        "op": "tenacity",
        "value": 0.04
      }
    ],
    "skills": [
      {
        "trigger": "periodic_seconds",
        "trigger_params": {
          "interval": 5.2
        },
        "mp_cost": 12,
        "effects": [
          {
            "op": "buff_self",
            "buff_id": "buff_sect_guard_drill",
            "duration": 2.4
          },
          {
            "op": "mp_regen_add",
            "value": 1.6
          }
        ]
      }
    ]
  },
  {
    "id": "gf_wudang_taiji_neigong_04",
    "name": "???????????",
    "type": "neigong",
    "description": "????????????",
    "element": "water",
    "quality": "purple",
    "cost": 360,
    "shop_visible": true,
    "tags": [
      "sect.tag_sect_wudang",
      "sect_name.??",
      "style.wudang_taiji",
      "type.neigong"
    ],
    "passive_effects": [
      {
        "op": "stat_add",
        "stat": "iat",
        "value": 14
      },
      {
        "op": "mp_regen_add",
        "value": 0.88
      }
    ],
    "skills": [
      {
        "trigger": "periodic_seconds",
        "trigger_params": {
          "interval": 4.45
        },
        "mp_cost": 16,
        "effects": [
          {
            "op": "buff_self",
            "buff_id": "buff_sect_guard_drill",
            "duration": 2.75
          },
          {
            "op": "heal_self",
            "value": 29.4
          }
        ]
      }
    ]
  },
  {
    "id": "gf_wudang_taiji_neigong_07",
    "name": "???????????",
    "type": "neigong",
    "description": "????????????",
    "element": "water",
    "quality": "orange",
    "cost": 520,
    "shop_visible": true,
    "tags": [
      "sect.tag_sect_wudang",
      "sect_name.??",
      "style.wudang_taiji",
      "type.neigong"
    ],
    "passive_effects": [
      {
        "op": "stat_add",
        "stat": "iat",
        "value": 17
      },
      {
        "op": "mp_regen_add",
        "value": 1.07
      }
    ],
    "skills": [
      {
        "trigger": "periodic_seconds",
        "trigger_params": {
          "interval": 4.05
        },
        "mp_cost": 18,
        "effects": [
          {
            "op": "buff_self",
            "buff_id": "buff_sect_guard_drill",
            "duration": 3.0
          },
          {
            "op": "heal_self",
            "value": 39.2
          }
        ]
      }
    ]
  },
  {
    "id": "gf_wudang_sword_neigong_04",
    "name": "???????????",
    "type": "neigong",
    "description": "????????????",
    "element": "metal",
    "quality": "purple",
    "cost": 360,
    "shop_visible": true,
    "tags": [
      "sect.tag_sect_wudang",
      "sect_name.??",
      "style.wudang_sword",
      "type.neigong"
    ],
    "passive_effects": [
      {
        "op": "stat_add",
        "stat": "iat",
        "value": 18
      },
      {
        "op": "mp_regen_add",
        "value": 0.88
      }
    ],
    "skills": [
      {
        "trigger": "periodic_seconds",
        "trigger_params": {
          "interval": 4.45
        },
        "mp_cost": 16,
        "effects": [
          {
            "op": "damage_aoe",
            "value": 44.8,
            "radius": 2,
            "damage_type": "internal"
          },
          {
            "op": "debuff_aoe",
            "buff_id": "debuff_sect_exposed_gap",
            "duration": 2.15,
            "radius": 2
          }
        ]
      }
    ]
  },
  {
    "id": "gf_huashan_core_neigong_00",
    "name": "????????????",
    "type": "neigong",
    "description": "????????????????",
    "element": "metal",
    "quality": "blue",
    "cost": 260,
    "shop_visible": true,
    "tags": [
      "sect.tag_sect_huashan",
      "sect_name.??",
      "style.huashan_jianzong",
      "style.huashan_qizong",
      "type.neigong",
      "role.shared_core"
    ],
    "passive_effects": [
      {
        "op": "stat_add",
        "stat": "iat",
        "value": 14
      },
      {
        "op": "mp_regen_add",
        "value": 1.2
      },
      {
        "op": "tenacity",
        "value": 0.04
      }
    ],
    "skills": [
      {
        "trigger": "periodic_seconds",
        "trigger_params": {
          "interval": 5.2
        },
        "mp_cost": 12,
        "effects": [
          {
            "op": "buff_self",
            "buff_id": "buff_sect_guard_drill",
            "duration": 2.4
          },
          {
            "op": "mp_regen_add",
            "value": 1.6
          }
        ]
      }
    ]
  },
  {
    "id": "gf_huashan_qizong_neigong_04",
    "name": "???????????",
    "type": "neigong",
    "description": "????????????",
    "element": "wood",
    "quality": "purple",
    "cost": 360,
    "shop_visible": true,
    "tags": [
      "sect.tag_sect_huashan",
      "sect_name.??",
      "style.huashan_qizong",
      "type.neigong"
    ],
    "passive_effects": [
      {
        "op": "stat_add",
        "stat": "iat",
        "value": 14
      },
      {
        "op": "mp_regen_add",
        "value": 0.88
      }
    ],
    "skills": [
      {
        "trigger": "periodic_seconds",
        "trigger_params": {
          "interval": 4.45
        },
        "mp_cost": 16,
        "effects": [
          {
            "op": "buff_self",
            "buff_id": "buff_sect_guard_drill",
            "duration": 2.75
          },
          {
            "op": "heal_self",
            "value": 29.4
          }